toko,nama_barang,review_text,rating,clean_text,has_kualitas_produk,has_harga,has_pengiriman,has_pelayanan,has_performa,has_packaging,sentiment_kualitas_produk,sentiment_harga,sentiment_pengiriman,sentiment_pelayanan,sentiment_performa,sentiment_packaging,text_length,word_count
samsung-official-store,Samsung Galaxy A26 5G [8/256] - Galaxy AI | Smartphone AI | Baterai 5000mAh,mantap,5,bagus,1,0,0,0,1,0,1,0,0,0,1,0,5,1
samsung-official-store,Samsung Galaxy Tab A9+ 8/128GB,mantep anjing,5,mantep anjing,0,0,0,0,0,0,0,0,0,0,0,0,13,2
samsung-official-store,Samsung Galaxy A16 LTE 8/128GB,Produk diterima dengan baik,5,produk diterima dengan baik,0,0,0,1,0,0,0,0,0,1,0,0,27,4
samsung-official-store,[ Baim Wong ] Samsung Galaxy A06 4/64GB,Sesuai pesan bosku terimakasih,5,sesuai pesan bosku terimakasih,0,0,0,0,0,0,0,0,0,0,0,0,30,4
samsung-official-store,Samsung Galaxy Tab A9+ 8/128GB,pengiriman cepat dan aman,5,pengiriman cepat dan aman,0,0,1,0,1,1,0,0,1,0,1,1,25,4
samsung-official-store,Samsung Galaxy A26 5G [8/256] - Galaxy AI | Smartphone AI | Baterai 5000mAh,pengiriman cepat dan aman,5,pengiriman cepat dan aman,0,0,1,0,1,1,0,0,1,0,1,1,25,4
samsung-official-store,[ Baim Wong ] Samsung Galaxy A06 4/64GB,Mantap..,5,bagus,1,0,0,0,1,0,1,0,0,0,1,0,5,1
samsung-official-store,Samsung Galaxy A26 5G [8/256] - Galaxy AI | Smartphone AI | Baterai 5000mAh,"pengiriman cepat packing aman.
paket sampai dengan aman dan berfunhsi dengan baik",5,pengiriman cepat packing aman paket sampai dengan aman dan berfunhsi dengan baik,0,0,1,1,1,1,0,0,1,1,1,1,80,12
samsung-official-store,Samsung Galaxy A06 4/128GB,"Maaf baru kasih ulasan, alhamdulillah paket udah keterima dengan baik, packing nya bagus gak ada kerusakan sama sekali❤️‍🔥",4,maaf baru kasih ulasan alhamdulillah paket sudah keterima dengan baik packing nya bagus tidak ada kerusakan sama sekali,1,0,0,1,1,1,0,0,0,0,1,-1,119,18
samsung-official-store,Samsung Galaxy A06 4/128GB,"Kejernihan lensa: jernih
Kualitas pengerjaan: bagu",5,kejernihan lensa jernih kualitas pengerjaan bagu,1,0,0,0,0,0,1,0,0,0,0,0,48,6
samsung-official-store,Samsung Galaxy A56 5G [12/256] - Galaxy AI | Smartphone AI | 50MP OIS HDR Camera | 45W Super Fast Charge AI Publish on,Packing aman cuma nama barang ngga disensor wkwk. Ngga dapat charger & case.,5,packing aman cuma nama barang ngga disensor wkwk ngga dapat charger case,1,0,0,0,0,1,-1,0,0,0,0,1,72,12
samsung-official-store,Samsung Galaxy S24 5G 8/256GB,"• barang datang dengan selamat, packing mantap, tebal dan berlapis-lapis, perlu waktu 10 menit untuk unboxing wkwk
• untuk HP nyala, tapi belum dicoba yang lain seperti S...",5,barang datang dengan selamat packing bagus tebal dan berlapis lapis perlu waktu menit untuk unboxing wkwk untuk hp nyala tapi belum dicoba yang lain seperti s,1,0,1,0,1,0,0,0,-1,0,1,0,158,26
samsung-official-store,Samsung Galaxy A16 LTE 8/128GB,"Produk sesuai pesanan, masih tersegel, dan dapar kepala charger ori",5,produk sesuai pesanan masih tersegel dan dapar kepala charger ori,0,0,0,0,0,0,0,0,0,0,0,0,65,10
samsung-official-store,[ Baim Wong ] Samsung Galaxy A06 4/64GB,Alhamdulillah barang sudah sampai barang bagus.semoga awet untuk kaum mendang mending🙏😂,5,alhamdulillah barang sudah sampai barang bagus semoga awet untuk kaum mendang mending,1,0,0,0,1,0,1,0,0,0,1,0,85,12
samsung-official-store,[ Baim Wong ] Samsung Galaxy A06 4/64GB,Sesuai pesanan🥰 langsung di pake sama bapake,5,sesuai pesanan langsung di pake sama bapake,0,0,0,0,0,0,0,0,0,0,0,0,43,7
samsung-official-store,[ Baim Wong ] Samsung Galaxy A06 4/64GB,"Produk asli, warnanya bagus, sangat puas, suka",5,produk asli warnanya bagus sangat puas suka,1,0,0,0,1,0,1,0,0,0,1,0,43,7
samsung-official-store,Samsung Galaxy A56 5G [8/256] [Upgrade dari 8/128 GB] - Galaxy AI | Smartphone AI | 50MP OIS HDR Camera | 45W Super Fast Charge,"Barang orisinil, pengemasan rapih dan aman, barang masih tersegel saat datang, barang berfungsi dengan baik, dapat harga diskon. 🌟🌟🌟🌟🌟🌟🌟",5,barang orisinil pengemasan rapih dan aman barang masih tersegel saat datang barang berfungsi dengan baik dapat harga diskon,0,0,0,1,0,1,0,0,0,1,0,1,123,18
samsung-official-store,[ Baim Wong ] Samsung Galaxy A06 4/64GB,"Paket sudah diterima..aman dan cepat
Thanks kurir dan toko..",5,paket sudah diterima aman dan cepat thanks kurir dan toko,0,0,1,0,1,1,0,0,1,0,1,1,57,10
samsung-official-store,[ Baim Wong ] Samsung Galaxy A06 4/64GB,"Baraang sudah sampai dengan selamat, awalnya ragu mau pesan, ternyata sesuai dengan gambar memausakan seemoga awet. Penjual amanah",5,baraang sudah sampai dengan selamat awalnya ragu mau pesan ternyata sesuai dengan gambar memausakan seemoga awet penjual amanah,0,0,1,0,0,1,0,0,-1,0,0,1,127,18
samsung-official-store,[ Baim Wong ] Samsung Galaxy A06 4/64GB,"Paket udah nyampe, sesuai sama gambar, tidak megecewakn. Mantap lh,,😁 sukses trus mas baim wong🙏🙏👍👍👌👌",5,paket sudah nyampe sesuai sama gambar tidak megecewakn bagus lh sukses trus mas baim wong,1,0,0,1,1,0,1,0,0,-1,1,0,89,15
samsung-official-store,[ Baim Wong ] Samsung Galaxy A06 4/64GB,"saya photo semuanya biar jelas semua gambar di handphone aneh, bukan cuman cameranya aja yg jelek. saya mau kembalikan.",5,saya photo semuanya biar jelas semua gambar di handphone aneh bukan cuman cameranya aja yg buruk saya mau kembalikan,1,0,0,1,1,1,-1,0,0,-1,1,-1,116,19
samsung-official-store,Samsung Galaxy A26 5G [8/256] - Galaxy AI | Smartphone AI | Baterai 5000mAh,Kamera bagus tapi hp cepat panas & boros baterai,4,kamera bagus tapi hp cepat panas boros baterai,1,0,1,0,1,0,1,0,1,0,0,0,46,8
samsung-official-store,[ Baim Wong ] Samsung Galaxy A16 5G 8/256GB,Sesuai.,4,sesuai,0,0,0,0,0,0,0,0,0,0,0,0,6,1
samsung-official-store,[ Baim Wong ] Samsung Galaxy A16 5G 8/256GB,Kejernihan lensa: Mantap,4,kejernihan lensa bagus,1,0,0,0,1,0,1,0,0,0,1,0,22,3
samsung-official-store,Samsung Galaxy A16 LTE 8/256GB,Mantap sesuai...,5,bagus sesuai,1,0,0,0,1,0,1,0,0,0,1,0,12,2
samsung-official-store,Samsung Galaxy A16 LTE 8/128GB,"barang sesuai deskripsi, ontime, segel,",5,barang sesuai deskripsi ontime segel,0,0,1,0,0,0,0,0,1,0,0,0,36,5
samsung-official-store,[ Baim Wong ] Samsung Galaxy A06 4/64GB,Paten👍,5,paten,0,0,0,0,0,0,0,0,0,0,0,0,5,1
samsung-official-store,[ Baim Wong ] Samsung Galaxy A06 4/64GB,Sesuai,5,sesuai,0,0,0,0,0,0,0,0,0,0,0,0,6,1
samsung-official-store,[ Baim Wong ] Samsung Galaxy A06 4/64GB,Mahal,1,mahal,0,1,0,0,0,0,0,-1,0,0,0,0,5,1
samsung-official-store,Samsung Galaxy A06 4/64GB,"barang diterima dengan baik, tepat waktu, kamera berfungsi dengan baik dan jernih, harga murah",5,barang diterima dengan baik tepat waktu kamera berfungsi dengan baik dan jernih harga murah,0,1,1,1,0,0,0,1,1,1,0,0,91,14
samsung-official-store,Samsung Galaxy Tab A9+ Wifi 4GB/64GB,amann,5,amann,0,0,0,0,0,1,0,0,0,0,0,1,5,1
samsung-official-store,Samsung Galaxy A16 LTE 8/128GB,Kejernihan lensa: Bagus,5,kejernihan lensa bagus,1,0,0,0,1,0,1,0,0,0,1,0,22,3
samsung-official-store,"Samsung Galaxy Buds3 - [Silver, White], Bluetooth Earbuds, Adaptive Noise Control, Hi-Fi Sound, Dual AMP","packing nya oke, barangnya berfungsi dengan baik, kualitas suaranya luar biasa keren 🤟",5,packing nya bagus barangnya berfungsi dengan baik kualitas suaranya luar biasa keren,1,0,0,1,1,0,1,0,0,1,1,0,84,12
samsung-official-store,[ Baim Wong ] Samsung Galaxy A06 4/64GB,"Alhamdulillah sudah sampai dengan selamat, jos paking rapih dan aman, kurirnya mau nunggu saat unboxing😁
Terimakasih pak kurir dan toko🙏",5,alhamdulillah sudah sampai dengan selamat jos paking rapih dan aman kurirnya mau nunggu saat unboxing terimakasih pak kurir dan toko,0,0,1,0,0,1,0,0,-1,0,0,1,132,20
samsung-official-store,"Samsung 43"" FHD F6000 TV | HDR | OTS Lite | One UI Tizen | UA43F6000FKXXD",kenapa ini setengah layar gaada sekelas samsung gini mana packing ga pake kayu buang duit gue aja,3,kenapa ini setengah layar gaada sekelas samsung gini mana packing tidak pake kayu buang duit gue aja,0,0,0,1,0,0,0,0,0,-1,0,0,100,17
samsung-official-store,[ Baim Wong ] Samsung Galaxy A06 4/64GB,Kerenn,5,kerenn,0,0,0,0,0,0,0,0,0,0,0,0,6,1
samsung-official-store,[ Baim Wong ] Samsung Galaxy A06 4/64GB,"speck rendah, ternyata harga sama kyak diluar",2,speck rendah ternyata harga sama kyak diluar,0,0,0,0,0,0,0,0,0,0,0,0,44,7
samsung-official-store,Samsung Soundbar HW-T420 2.1 Ch dengan Powerful Subwoofer,"barang ori, dan suara mantap skl. worth it banget",5,barang ori dan suara bagus skl sebanding it banget,1,1,0,0,1,0,1,1,0,0,1,0,50,9
samsung-official-store,Samsung Galaxy A06 4/64GB,Masyaallah pket sudah datang dlm keadaan baik dan dpat digunakan dengan baik,5,masyaallah pket sudah datang dlm keadaan baik dan dpat digunakan dengan baik,0,0,0,1,0,0,0,0,0,1,0,0,76,12
samsung-official-store,[ Baim Wong ] Samsung Galaxy A06 4/64GB,Mantap🥰,5,bagus,1,0,0,0,1,0,1,0,0,0,1,0,5,1
samsung-official-store,Samsung Galaxy A56 5G [12/256] - Galaxy AI | Smartphone AI | 50MP OIS HDR Camera | 45W Super Fast Charge AI Publish on,manteep,5,manteep,0,0,0,0,0,0,0,0,0,0,0,0,7,1
samsung-official-store,"Samsung Galaxy Watch7 [40mm] - [Green, Cream], Smartwatch AI, Prosesor 3nm, Sleep Apnea Monitoring, Dual GPS",saya beli produk ini di toko ini. saat pembelian ada tertulis di foto diskon 50% samsung care+ yang bisa di klaim di samsung gift. saya sudah cek tetapi tidak ada. Sudah...,1,saya beli produk ini di toko ini saat pembelian ada tertulis di foto diskon samsung care yang bisa di klaim di samsung gift saya sudah cek tetapi tidak ada sudah,0,0,0,1,0,0,0,0,0,-1,0,0,161,30
samsung-official-store,Samsung Galaxy A16 5G 8/256GB,"kemasan bagus ,masi di segel",5,kemasan bagus masi di segel,1,0,0,0,1,1,1,0,0,0,1,1,27,5
samsung-official-store,[ Baim Wong ] Samsung Galaxy A06 4/64GB,Alhmdulillah brang sudh datang aman tdak lecet,5,alhmdulillah brang sudh datang aman tdak lecet,0,0,0,0,0,1,0,0,0,0,0,1,46,7
samsung-official-store,Samsung Galaxy A16 LTE 8/256GB,"Cepat sampainya,,,barangnya ori.pengemasan baik🙏",5,cepat sampainya barangnya ori pengemasan baik,0,0,1,1,1,0,0,0,1,1,1,0,45,6
samsung-official-store,Samsung Galaxy A06 4/64GB,"sangat puas
pengiriman cepat",5,sangat puas pengiriman cepat,0,0,1,0,1,0,0,0,1,0,1,0,28,4
samsung-official-store,[ Baim Wong ] Samsung Galaxy A06 4/64GB,Lumayan,5,lumayan,0,0,0,0,0,0,0,0,0,0,0,0,7,1
samsung-official-store,[ Baim Wong ] Samsung Galaxy A06 4/64GB,Mendarat dengan amann,5,mendarat dengan amann,0,0,0,0,0,1,0,0,0,0,0,1,21,3
samsung-official-store,[ Baim Wong ] Samsung Galaxy A06 4/64GB,Rekomen seller.. barang ORI.. joss,5,rekomen seller barang ori joss,0,0,0,0,0,0,0,0,0,0,0,0,30,5
samsung-official-store,Samsung Galaxy Fit3 - Smartwatch,baaaaaaaaaaaaaaguuuuuuuus baaaaaaaaangeeeeet,5,baaaaaaaaaaaaaaguuuuuuuus baaaaaaaaangeeeeet,0,0,0,0,0,0,0,0,0,0,0,0,44,2
samsung-official-store,[ Baim Wong ] Samsung Galaxy A06 4/64GB,Ok,5,bagus,1,0,0,0,1,0,1,0,0,0,1,0,5,1
samsung-official-store,[ Baim Wong ] Samsung Galaxy A06 4/64GB,"Hp Lemot banget
Performa sistem: Ngk ada jaringan",3,hp lemot banget performa sistem ngk ada jaringan,0,0,0,0,1,0,0,0,0,0,-1,0,48,8
samsung-official-store,"Samsung 32"" HD HE50E TV | HDR | OTS Lite | One UI Tizen | Slim Design | UA32HE50EFKLXD",Barang sesuai pesanan bagus...terima kasih,5,barang sesuai pesanan bagus terima kasih,1,0,0,0,1,0,1,0,0,0,1,0,40,6
samsung-official-store,Samsung Galaxy A06 6/128GB - | Baterai 6.000 mAh | 25W Fast Charging,Sesuai dengan pesanan,5,sesuai dengan pesanan,0,0,0,0,0,0,0,0,0,0,0,0,21,3
samsung-official-store,[ Baim Wong ] Samsung Galaxy A06 4/64GB,Bagus banget..,5,bagus banget,1,0,0,0,1,0,1,0,0,0,1,0,12,2
samsung-official-store,Samsung Galaxy A16 5G 8/256GB,"gagah pokoknya mah samsung, lebih enak pake samsung daripada iphone. tp samsung yg ini mah cuma buat maen game doang sih",5,gagah pokoknya mah samsung lebih enak pake samsung daripada iphone tapi samsung yg ini mah cuma buat maen game doang sih,0,0,0,0,0,0,0,0,0,0,0,0,120,21
samsung-official-store,[ Baim Wong ] Samsung Galaxy A06 4/64GB,Sangat luar biasa makasih,5,sangat luar biasa makasih,0,0,0,0,0,0,0,0,0,0,0,0,25,4
samsung-official-store,Samsung Galaxy Tab A9 Wifi 4/64GB - Graphite,"puas. perangkat bagus, harga bagus, kualitas monitor samsung.. 5 bintang",5,puas perangkat bagus harga bagus kualitas monitor samsung bintang,1,0,0,0,1,0,1,0,0,0,1,0,65,9
samsung-official-store,[ Baim Wong ] Samsung Galaxy A06 4/64GB,"Sudah datang dengan baik👍
Makasih🙏☺ semoga selalu amanah😊",5,sudah datang dengan baik makasih semoga selalu amanah,0,0,0,1,0,1,0,0,0,1,0,1,53,8
samsung-official-store,Samsung Galaxy A16 LTE 8/128GB,Pengiriman cepet hv nya juga bagus,5,pengiriman cepet hv nya juga bagus,1,0,0,0,1,0,1,0,0,0,1,0,34,6
samsung-official-store,Samsung Galaxy A06 4/64GB,Barang sampe dgn aman,5,barang sampe dgn aman,0,0,0,0,0,1,0,0,0,0,0,1,21,4
samsung-official-store,Samsung Galaxy A56 5G [12/256] - Galaxy AI | Smartphone AI | 50MP OIS HDR Camera | 45W Super Fast Charge AI Publish on,"Cantik pink nyaa ,bener udah di up memori ..packing aman juga disini lebihbmurah",5,cantik pink nyaa benar sudah di up memori packing aman juga disini lebihbmurah,0,1,0,0,0,1,0,1,0,0,0,1,78,13
samsung-official-store,[ Putra Siregar ] Samsung Galaxy Tab A9 Wifi 4/64GB,Bagus,5,bagus,1,0,0,0,1,0,1,0,0,0,1,0,5,1
samsung-official-store,Samsung Galaxy A16 5G 8/256GB,Moga awet yaaa,5,moga awet yaaa,0,0,0,0,0,0,0,0,0,0,0,0,14,3
samsung-official-store,[ Baim Wong ] Samsung Galaxy A06 4/64GB,Alhamdulillah Dateng masih ORI,5,alhamdulillah dateng masih ori,0,0,0,0,0,0,0,0,0,0,0,0,30,4
samsung-official-store,[ Nabilfitrah ] Samsung Galaxy A56 5G [8/256] [Upgrade dari 8/128 GB] - Galaxy AI | Smartphone AI | 50MP OIS HDR Camera | 45W Super Fast Charge,Oke real,5,bagus real,1,0,0,0,1,0,1,0,0,0,1,0,10,2
samsung-official-store,Samsung Galaxy S24 Ultra 5G 12/256GB [Smartphone],"Alhamdulillah paketnya sdh mendarat, packaging nya benar² super aman, pengiriman nya cepat dan barang sesuai dgn yg di foto dan terjamin kualitasnya, terimakasih Samsung...",5,alhamdulillah paketnya sdh mendarat packaging nya benar super aman pengiriman nya cepat dan barang sesuai dgn yg di foto dan terjamin kualitasnya terimakasih samsung,1,0,1,0,1,1,1,0,1,0,1,1,165,24
samsung-official-store,[ Baim Wong ] Samsung Galaxy A16 5G 8/256GB,"bagusss bangeg jujur amanahhh ,tpi lambat di kemas tpi ,its ok lahhh",5,bagusss bangeg jujur amanahhh tpi lambat di kemas tpi its bagus lahhh,1,0,1,1,1,1,1,0,-1,-1,0,1,69,12
samsung-official-store,Samsung Galaxy A06 6/128GB - | Baterai 6.000 mAh | 25W Fast Charging,Mantap,5,bagus,1,0,0,0,1,0,1,0,0,0,1,0,5,1
samsung-official-store,[ Baim Wong ] Samsung Galaxy A06 4/64GB,Sesuai ekspektasi,5,sesuai ekspektasi,0,0,0,0,0,0,0,0,0,0,0,0,17,2
samsung-official-store,"Samsung Smart TV 50"" Crystal UHD 4K DU7000 4K - UA50DU7000KXXD","Barang tiba dengan aman, packing bagus, tp respon admin nya, parahhhhhhhhh, chat jarang di balas",1,barang tiba dengan aman packing bagus tapi responsif admin nya parahhhhhhhhh chat jarang di balas,1,0,0,1,1,1,0,0,0,1,1,1,97,15
samsung-official-store,Samsung Galaxy A06 4/64GB,"alhamdulillah, barang selamat sampai tujuan makasih samsung",5,alhamdulillah barang selamat sampai tujuan makasih samsung,0,0,1,0,0,0,0,0,-1,0,0,0,58,7
samsung-official-store,Samsung Galaxy A56 5G [12/256] - Galaxy AI | Smartphone AI | 50MP OIS HDR Camera | 45W Super Fast Charge AI Publish on,Alhamdulillah sudah sampai hp samsung A56 masih segel dus.,4,alhamdulillah sudah sampai hp samsung a masih segel dus,0,0,0,0,0,0,0,0,0,0,0,0,55,9
samsung-official-store,Samsung Galaxy A06 4/128GB,barangnya ori cuma pengemasan nya lama,2,barangnya ori cuma pengemasan nya lambat,0,0,1,1,1,0,0,0,-1,-1,-1,0,40,6
samsung-official-store,"Samsung Galaxy Watch7 [40mm] - [Green, Cream], Smartwatch AI, Prosesor 3nm, Sleep Apnea Monitoring, Dual GPS","Sangat mengecewakan!! Tidak bs konek dg S23+. Sdh coba semua cara, update android & wearable, unpair-pair, dll, tetap gagal saat 70-80% selalu. Toko resmi harusnya ka...",1,sangat mengecewakan tidak bs konek dg s sdh coba semua cara update android wearable unpair pair dll tetap gagal saat selalu toko resmi harusnya ka,0,0,0,1,0,0,0,0,0,-1,0,0,146,25
samsung-official-store,Samsung Galaxy A26 5G [8/256] - Galaxy AI | Smartphone AI | Baterai 5000mAh,sipp 2 kali beli di toko ini . terpecaya dan sangat amanah . next mau beli lagi buat ibu saya . semoga senantiasa di berkati semua . amin,5,sipp kali beli di toko ini terpecaya dan sangat amanah next mau beli lagi buat ibu saya semoga senantiasa di berkati semua amin,0,0,0,0,1,1,0,0,0,0,-1,1,127,23
samsung-official-store,"Samsung Galaxy S24 FE [8/256] - [Blue, Graphite, Gray] Smartphone AI, AI Phone, Handphone AI, Kamera 50MP, Layar besar, RAM besar, Baterai tahan lama","Pengiriman Cepat, packing barangnya aman, overall good service",5,pengiriman cepat packing barangnya aman overall good service,0,0,1,0,1,1,0,0,1,0,1,1,60,8
samsung-official-store,Samsung Galaxy A06 4/128GB,"barang segel dan lengkap masih original dan tidak fake, pengiriman agak lambat dikit tapi so far oklah semua",5,barang segel dan lengkap masih original dan tidak fake pengiriman agak lambat dikit tapi so far oklah semua,1,0,1,1,1,0,0,0,-1,-1,-1,0,107,18
samsung-official-store,[ Baim Wong ] Samsung Galaxy A06 4/64GB,"Sesuai pesanan,original 100%  terima kasih Bang Baim wong",5,sesuai pesanan original terima kasih bang baim wong,1,0,0,0,0,0,1,0,0,0,0,0,51,8
samsung-official-store,[ Baim Wong ] Samsung Galaxy A06 4/64GB,Alhamdulillah udh mendarat  hp nya bagus bgt aku ujan,5,alhamdulillah sudah mendarat hp nya bagus banget aku ujan,1,0,0,0,1,0,1,0,0,0,1,0,57,9
samsung-official-store,Samsung Galaxy A06 4/64GB,"Sudah dicoba, bagus. Sesuai dengan harga
Thank you samsung!",5,sudah dicoba bagus sesuai dengan harga thank you samsung,1,0,0,0,1,0,1,0,0,0,1,0,56,9
samsung-official-store,Samsung Galaxy A16 LTE 8/256GB,Bagus,5,bagus,1,0,0,0,1,0,1,0,0,0,1,0,5,1
samsung-official-store,Samsung Galaxy A06 4/128GB,anak sy seneng banget dikasih kado ultah hp ini,5,anak sy seneng banget dikasih kado ultah hp ini,0,0,0,0,0,0,0,0,0,0,0,0,47,9
samsung-official-store,[ Baim Wong ] Samsung Galaxy A06 4/64GB,Ok banget,5,bagus banget,1,0,0,0,1,0,1,0,0,0,1,0,12,2
samsung-official-store,Samsung Galaxy A56 5G [12/256] - Galaxy AI | Smartphone AI | 50MP OIS HDR Camera | 45W Super Fast Charge AI Publish on,mantap bagus bangetttttttt,5,bagus bagus bangetttttttt,1,0,0,0,1,0,1,0,0,0,1,0,25,3
samsung-official-store,[ Baim Wong ] Samsung Galaxy A16 5G 8/256GB,Bagusss polll amanah juga,5,bagusss polll amanah juga,1,0,0,0,1,1,1,0,0,0,1,1,25,4
samsung-official-store,[ Baim Wong ] Samsung Galaxy A06 4/64GB,Thx hp sdh diterima dg baik,5,thx hp sdh diterima dg baik,0,0,0,1,0,0,0,0,0,1,0,0,27,6
samsung-official-store,Samsung Galaxy Fit3 - Smartwatch,Barang sampai dirumah dalam keadaan baik dan berfingsi dengan baik. top seller jangan ragu lagi berbelanja disini,5,barang sampai dirumah dalam keadaan baik dan berfingsi dengan baik top seller jangan ragu lagi berbelanja disini,0,0,0,1,1,0,0,0,0,1,-1,0,112,17
samsung-official-store,[ Baim Wong ] Samsung Galaxy A06 4/64GB,sedikit ada ke anehan,5,sedikit ada ke anehan,0,0,0,0,0,0,0,0,0,0,0,0,21,4
samsung-official-store,[ Baim Wong ] Samsung Galaxy A06 4/64GB,Mantap sesuai dengan pesanan,5,bagus sesuai dengan pesanan,1,0,0,0,1,0,1,0,0,0,1,0,27,4
samsung-official-store,Samsung Galaxy A16 LTE 8/128GB,Bagus hp nya next bakal order lagi,5,bagus hp nya next bakal order lagi,1,0,0,0,1,0,1,0,0,0,0,0,34,7
samsung-official-store,Samsung Galaxy A16 LTE 8/128GB,"ok,sesuai pesanan,,semua hidup,,kecuali pengiriman agak lama",5,bagus sesuai pesanan semua hidup kecuali pengiriman agak lambat,1,0,1,1,1,0,1,0,-1,-1,0,0,63,9
samsung-official-store,[ Baim Wong Exclusive ] Samsung Galaxy Tab A9 Wifi 4GB/64GB,All good,5,all good,0,0,0,0,0,0,0,0,0,0,0,0,8,2
samsung-official-store,Samsung Galaxy A56 5G [12/256] - Galaxy AI | Smartphone AI | 50MP OIS HDR Camera | 45W Super Fast Charge AI Publish on,Keren mantab,5,keren mantab,0,0,0,0,0,0,0,0,0,0,0,0,12,2
samsung-official-store,Samsung Galaxy S24 Ultra 5G 12/256GB [Smartphone],mantap,5,bagus,1,0,0,0,1,0,1,0,0,0,1,0,5,1
samsung-official-store,Samsung Galaxy Tab A9 Wifi 4/64GB - Graphite,"Aman sampai Papua, makasih. Barang bergaransi ORI. Thanks",5,aman sampai papua makasih barang bergaransi ori thanks,0,0,0,0,0,1,0,0,0,0,0,1,54,8
samsung-official-store,[ Baim Wong ] Samsung Galaxy A06 4/64GB,Real pict. Amanah. Thank U..,5,real pict amanah thank u,0,0,0,0,0,1,0,0,0,0,0,1,24,5
samsung-official-store,Samsung Galaxy A06 4/64GB,Sangat bagus untuk harga under 1.5 juta aan,5,sangat bagus untuk harga under juta aan,1,0,0,0,1,0,1,0,0,0,1,0,39,7
samsung-official-store,Samsung Galaxy A16 LTE 8/256GB,barang asli pengiriman cepat ada bonus kartu axis.👍,5,barang asli pengiriman cepat ada bonus kartu axis,1,0,1,0,1,0,1,0,1,0,1,0,49,8
samsung-official-store,[ Baim Wong ] Samsung Galaxy A06 4/64GB,Ori,5,ori,0,0,0,0,0,0,0,0,0,0,0,0,3,1
samsung-official-store,Samsung Galaxy A06 4/128GB,Good condition,5,good condition,0,0,0,0,0,0,0,0,0,0,0,0,14,2
samsung-official-store,[ Baim Wong Exclusive ] Samsung Galaxy Tab A9 Wifi 4GB/64GB,alhamdulillah produk ori brg dtg sesui packing aman banyak bablewrap❤️,5,alhamdulillah produk ori brg dtg sesui packing aman banyak bablewrap,0,0,0,0,0,1,0,0,0,0,0,1,68,10
samsung-official-store,Samsung Galaxy A16 LTE 8/128GB,"baguss , tapi respon admin lama, bahkan chat gak d buka2 😁😁",5,baguss tapi responsif admin lambat bahkan chat tidak d buka,1,0,1,1,1,0,1,0,-1,0,0,0,59,10
samsung-official-store,[ Baim Wong ] Samsung Galaxy A06 4/64GB,Sukaaa,5,sukaaa,0,0,0,0,0,0,0,0,0,0,0,0,6,1
samsung-official-store,Samsung Galaxy A06 6/128GB - | Baterai 6.000 mAh | 25W Fast Charging,mantap barang ori,5,bagus barang ori,1,0,0,0,1,0,1,0,0,0,1,0,16,3
samsung-official-store,Samsung Galaxy A06 5G [6/128] Gaming Package - Light Green | 5.000 mAh | 25W Fast Charging,"hp nya keren, kotaknya gede banget ternyata ada aksesorisnya didalam, senang banget ☺️👍👍👍",5,hp nya keren kotaknya gede banget ternyata ada aksesorisnya didalam senang banget,0,0,0,0,0,0,0,0,0,0,0,0,81,12
samsung-official-store,Samsung Galaxy Tab A9 Wifi 4/64GB - Graphite,"Sudah sesuai, barangnya bisa digunakan dg baik",5,sudah sesuai barangnya bisa digunakan dg baik,0,0,0,1,0,0,0,0,0,1,0,0,45,7
samsung-official-store,[ Baim Wong ] Samsung Galaxy A06 4/64GB,Sangat memuaskan,4,sangat memuaskan,0,0,0,0,0,0,0,0,0,0,0,0,16,2
samsung-official-store,Samsung Galaxy A16 LTE 8/128GB,"Barang bagus, berfungsi normal. Ready dan update stok, deskripsi lengkap, bisa langsung langsung beli tanpa harus ribet nanya 👍 recommended store.",5,barang bagus berfungsi normal ready dan update stok deskripsi lengkap bisa langsung langsung beli tanpa harus ribet nanya rekomendasi store,1,0,0,0,1,0,1,0,0,0,1,0,139,20
samsung-official-store,Samsung Galaxy A56 5G [12/256] - Galaxy AI | Smartphone AI | 50MP OIS HDR Camera | 45W Super Fast Charge AI Publish on,"AKUN PEMBELIAN SAMSUNG YG PALING TERPERCAYAA SE INDONESIA🤩🤩🤩🤩🤩
Barang lebih fresh dan original. harga lebih murah dari store2 yg lain. dijamin tidak akan menyesal. T...",5,akun pembelian samsung yg paling terpercayaa se indonesia barang lebih fresh dan original harga lebih murah dari store yg lain dijamin tidak akan menyesal t,1,1,0,1,0,0,1,1,0,-1,0,0,156,25
samsung-official-store,Samsung Galaxy Tab A9 Wifi 4/64GB - Graphite,"pengiriman cepat, packing aman, tablet sdh dicoba dan berfungsi baik..
bocil pada seneng..",5,pengiriman cepat packing aman tablet sdh dicoba dan berfungsi baik bocil pada seneng,0,0,1,1,1,1,0,0,1,1,1,1,84,13
samsung-official-store,Samsung Galaxy A16 LTE 8/256GB,"Barang masih disegel, pengirimannya cepat dan aman",5,barang masih disegel pengirimannya cepat dan aman,0,0,1,0,1,1,0,0,1,0,1,1,49,7
samsung-official-store,Samsung Galaxy S24 FE 8/512GB,Produk sesuai dengan,5,produk sesuai dengan,0,0,0,0,0,0,0,0,0,0,0,0,20,3
samsung-official-store,Samsung Galaxy Tab A9 Wifi 4/64GB - Graphite,Mantul,5,bagus,1,0,0,0,1,0,1,0,0,0,1,0,5,1
samsung-official-store,Samsung Galaxy A06 4/128GB,Pesanan sudah sampai sesuai dengan pesanan walau tidak sesuai dengan estimasi,5,pesanan sudah sampai sesuai dengan pesanan walau tidak sesuai dengan estimasi,0,0,0,1,0,0,0,0,0,-1,0,0,77,11
samsung-official-store,[ Baim Wong ] Samsung Galaxy A06 4/64GB,"Sempet ragu takut gagal takut ilang pokoknya parno perdana banget beli online.. 
Buuuut ma sya allah datang dengan cepat pesen tgl 3 tgl 4 syudah sampai 
Si mas kurirnyaa...",5,sempet ragu takut gagal takut ilang pokoknya parno perdana banget beli online buuuut ma sya allah datang dengan cepat pesen tgl tgl syudah sampai si mas kurirnyaa,0,0,1,0,1,0,0,0,1,0,1,0,162,27
samsung-official-store,Samsung Galaxy A16 LTE 8/128GB,Sesuaiiii hpnya ori kok maaf ga ada gambar soalnya lagsg dipake anak,5,sesuaiiii hpnya ori kok maaf tidak ada gambar soalnya lagsg dipake anak,0,0,0,1,1,0,0,0,0,-1,-1,0,71,12
samsung-official-store,"Samsung Galaxy Watch7 [40mm] - [Green, Cream], Smartwatch AI, Prosesor 3nm, Sleep Apnea Monitoring, Dual GPS","mantap sangat cepat pengiriman, barang sampai dipemilik aman",5,bagus sangat cepat pengiriman barang sampai dipemilik aman,1,0,1,0,1,1,1,0,1,0,1,1,58,8
samsung-official-store,Samsung Galaxy Fit3 - Smartwatch,sangat baik,5,sangat baik,0,0,0,1,0,0,0,0,0,1,0,0,11,2
samsung-official-store,Samsung Galaxy A16 LTE 8/128GB,Ok,5,bagus,1,0,0,0,1,0,1,0,0,0,1,0,5,1
samsung-official-store,[ Baim Wong ] Samsung Galaxy A16 5G 8/256GB,bagusss bangettttttt the bestt,5,bagusss bangettttttt the bestt,1,0,0,0,1,0,1,0,0,0,1,0,30,4
samsung-official-store,Samsung Galaxy A16 LTE 8/128GB,"marah sudah sampai, segel dan lengkap, mantap",5,marah sudah sampai segel dan lengkap bagus,1,0,0,0,1,0,1,0,0,0,1,0,42,7
samsung-official-store,[ Baim Wong ] Samsung Galaxy A06 4/64GB,Bagus,5,bagus,1,0,0,0,1,0,1,0,0,0,1,0,5,1
