toko,nama_barang,review_text,rating,clean_text,has_kualitas_produk,has_harga,has_pengiriman,has_pelayanan,has_performa,has_packaging,sentiment_kualitas_produk,sentiment_harga,sentiment_pengiriman,sentiment_pelayanan,sentiment_performa,sentiment_packaging,text_length,word_count
xiaomi,"Xiaomi Redmi A5 (4+128) Kamera 32MP | Layar 6.88"" | Baterai 5200mAh | Octa Core anti lemot [Official Store]",mantaal,5,mantaal,0,0,0,0,0,0,0,0,0,0,0,0,7,1
xiaomi,Xiaomi TV A Pro 43 2026 | 4K QLED HDR10+ | Dolby Audio | Google TV | Apple Airplay [Official Store],"TV-nya bagus, tapi kurirnya jelek.
Paket sempat diam di gudang pengiriman selama beberapa hari sampai saya komplain ke pihak Tokped maupun Kurir.",5,tv nya bagus tapi kurirnya buruk paket sempat diam di gudang pengiriman selama beberapa hari sampai saya komplain ke pihak tokped maupun kurir,1,0,1,1,1,1,0,0,-1,-1,1,-1,142,23
xiaomi,Xiaomi Electric Shaver S200 | Mata pisau dua alur | Kepala cukur lepas pasang | IPX7 Anti Air | Sensor otomatis saat sentuh wajah [Official Store],mantab barang dateng dengan batreai  full jadi bisa langsung dicoba,5,mantab barang dateng dengan batreai full jadi bisa langsung dicoba,0,0,0,0,0,0,0,0,0,0,0,0,66,10
xiaomi,Xiaomi Redmi Buds 6 Play | Bluetooth 5.4 | Baterai Hingga 36 Jam | Xiaomi Earbuds App Support | Nyaman Digunakan [Official Store],bagus bagus nyaman nyaman mantap kondisi bagus suara bagus,5,bagus bagus nyaman nyaman bagus kondisi bagus suara bagus,1,0,0,0,1,1,1,0,0,0,1,1,57,9
xiaomi,POCO X7 Pro 5G | Dimensity 8400-Ultra | 6000mAh 90W HyperCharge | CrystalRes 1.5K AMOLED [Official Store],"Pengirimannya sangat cepat, sangat sesuai ekspektasi",5,pengirimannya sangat cepat sangat sesuai ekspektasi,0,0,1,0,1,0,0,0,1,0,1,0,51,6
xiaomi,"Official Xiaomi POCO Pad (8GB+256GB) | Snapdragon 7s Gen 2 | Layar 2,5K 12,1"" 120 Hz | Kapasitas baterai besar 10.000 mAh",Bagus dan sesuai ekspektasi,4,bagus dan sesuai ekspektasi,1,0,0,0,1,0,1,0,0,0,1,0,27,4
xiaomi,Xiaomi Redmi Note 14 | 108 MP AI Camera | 5500mAh 33W Turbo Charging | MediaTek Helio G99 Ultra | [Official Store],barang sdh sampai dengan selamat aman masih tersegel makasih,5,barang sdh sampai dengan selamat aman masih tersegel makasih,0,0,1,0,0,1,0,0,-1,0,0,1,60,9
xiaomi,Official Xiaomi POCO M6 (8GB+256GB) | Kamera utama 108 MP kelas pro | Helio G91-Ultra yang tangguh | 33 W Turbo Charging,"bagus, packing aman, produk sesuai deskripsi. produk berfungsi dengan baik",5,bagus packing aman produk sesuai deskripsi produk berfungsi dengan baik,1,0,0,1,1,1,1,0,0,1,1,1,71,10
xiaomi,Official Xiaomi POCO M6 (8GB+256GB) | Kamera utama 108 MP kelas pro | Helio G91-Ultra yang tangguh | 33 W Turbo Charging,ok hp normal semoga awet....................................,5,bagus hp normal semoga awet,1,0,0,0,1,0,1,0,0,0,1,0,27,5
xiaomi,Xiaomi Redmi 13X (8G/128G) (8G/256G) | 108 MP makin auto glow-up kamera | 5030mAh 33W | NFC [Official Store],"Berfungsi dengan baik,barang ori,worth it dengan harga segitu, pengiriman cepat",5,berfungsi dengan baik barang ori sebanding it dengan harga segitu pengiriman cepat,0,1,1,1,1,0,0,1,1,1,1,0,82,12
xiaomi,Xiaomi Electric Shaver S200 | Mata pisau dua alur | Kepala cukur lepas pasang | IPX7 Anti Air | Sensor otomatis saat sentuh wajah [Official Store],"Sesuai ekspektasi, baru tahu malah bisa nyala mati otomatis. Praktis dan simpel dibawa kemana-mana",5,sesuai ekspektasi baru tahu malah bisa nyala mati otomatis praktis dan simpel dibawa kemana mana,0,0,0,0,0,0,0,0,0,0,0,0,96,15
xiaomi,POCO M7 Pro 5G (8/256G) | Dimensity 7025-Ultra | 5110mAh battery | 120Hz AMOLED | 50MP OIS [Official Store],"produk memuaskan, packing jg aman..",5,produk memuaskan packing jg aman,0,0,0,0,0,1,0,0,0,0,0,1,32,5
xiaomi,"POCO F7 (12/512GB) | Snapdragon 8s Gen 4 | 6.83"" 1.5K 120Hz AMOLED | 50MP camera OIS [Official Store]","mantab 8s gen 4 jangan ragu sikat aja 
kamera performa oke semua",5,mantab s gen jangan ragu sikat aja kamera performa bagus semua,1,0,0,0,1,0,1,0,0,0,1,0,62,11
xiaomi,"Xiaomi Redmi Pad SE 8.7 (4/128GB) | Layar 8.7"" | 90Hz | Baterai 6650mAh | Octa-Core [Official Store]","Barang original, respon seller cepat, pengiriman cepatt",5,barang original responsif seller cepat pengiriman cepatt,1,0,1,1,1,0,1,0,1,1,1,0,56,7
xiaomi,"POCO F7 (12/512GB) | Snapdragon 8s Gen 4 | 6.83"" 1.5K 120Hz AMOLED | 50MP camera OIS [Official Store]",good min mantap dah.,5,good min bagus dah,1,0,0,0,1,0,1,0,0,0,1,0,18,4
xiaomi,"Xiaomi Redmi Watch 5 Active | 2.0"" LCD Display | Mendukung 140+ mode olahraga | Tahan air 5ATM | Baterai tahan hingga 18 hari | Jam tangan pintar [Official Store]",berfungsi dgn baik ya..thanks seller top,5,berfungsi dgn baik ya thanks seller top,0,0,0,1,0,0,0,0,0,1,0,0,39,7
xiaomi,"Xiaomi Smart Band 9 Active | Bodi 9,99 mm | Tahan Air Hingga 50 Meter | 50+ Mode Olahraga | Baterai Hingga 18 Hari [Official Store]","seller responsif dan amanah, delivery cepet banget sehari aja, barang berfungsi dengan baik 👍",5,seller responsif dan amanah delivery cepet banget sehari aja barang berfungsi dengan baik,0,0,0,1,0,1,0,0,0,1,0,1,89,13
xiaomi,Official Xiaomi POCO M6 (8GB+256GB) | Kamera utama 108 MP kelas pro | Helio G91-Ultra yang tangguh | 33 W Turbo Charging,"barangnya sangat bagus, worth it untuk harga di bawah 2jt, batre memang berasa cepet abis, tapi pengisian juga cepat.",5,barangnya sangat bagus sebanding it untuk harga di bawah jt batre memang berasa cepet abis tapi pengisian juga cepat,1,1,1,0,1,0,1,1,1,0,1,0,116,19
xiaomi,Xiaomi Redmi Note 14 Pro+ 5G | 200 MP AI Camera OIS | 120W HyperCharge 5110mAh | Gorilla Victus 2 | [Official Store],Pengiriman agak lama. Barang sampai sesuai deskripsi nomor imei jg sdh dkonfirmasi via chat wa admin. Semoga awet,4,pengiriman agak lambat barang sampai sesuai deskripsi nomor imei jg sdh dkonfirmasi via chat wa admin semoga awet,0,0,1,1,1,0,0,0,-1,-1,-1,0,113,18
xiaomi,POCO X7 Pro 5G | Dimensity 8400-Ultra | 6000mAh 90W HyperCharge | CrystalRes 1.5K AMOLED [Official Store],"bagus sesuai perikraan, mudah2 untuk hardware soft ware nya aman juga",5,bagus sesuai perikraan mudah untuk hardware soft ware nya aman juga,1,0,0,0,1,1,1,0,0,0,1,1,67,11
xiaomi,Xiaomi Redmi Note 14 | 108 MP AI Camera | 5500mAh 33W Turbo Charging | MediaTek Helio G99 Ultra | [Official Store],"adminya slwrespon, pengirimanya lama punya. baras sudah di kemas 3 hari baru di ambil parah JNE",3,adminya slwrespon pengirimanya lambat punya baras sudah di kemas hari baru di ambil buruk jne,1,0,1,1,1,1,-1,0,-1,-1,-1,-1,93,15
xiaomi,"Xiaomi Redmi Pad 2 (4/128G) | 11"" 2.5 Layar Super-jernih | Helio G100-Ultra [Official Store]","Barang berkualitas dan berfungsi baik.
pengiriman cepat 
rekomen",5,barang berkualitas dan berfungsi baik pengiriman cepat rekomen,1,0,1,1,1,0,1,0,1,1,1,0,62,8
xiaomi,"POCO F7 (12/512GB) | Snapdragon 8s Gen 4 | 6.83"" 1.5K 120Hz AMOLED | 50MP camera OIS [Official Store]",jangan bikin konsumen emosi dengan proses yg lama,1,jangan bikin konsumen emosi dengan proses yg lambat,0,0,1,1,1,0,0,0,-1,-1,-1,0,51,8
xiaomi,POCO X7 Pro 5G | Dimensity 8400-Ultra | 6000mAh 90W HyperCharge | CrystalRes 1.5K AMOLED [Official Store],mantap beli yg kedua kalinya,5,bagus beli yg kedua kalinya,1,0,0,0,1,0,1,0,0,0,1,0,27,5
xiaomi,"POCO F7 (12/512GB) | Snapdragon 8s Gen 4 | 6.83"" 1.5K 120Hz AMOLED | 50MP camera OIS [Official Store]","barang bagus, lama sampe, kurir jelek",5,barang bagus lambat sampe kurir buruk,1,0,1,1,1,1,0,0,-1,-1,0,-1,37,6
xiaomi,"Xiaomi Redmi Pad 2 (4/128G) | 11"" 2.5 Layar Super-jernih | Helio G100-Ultra [Official Store]","belum dibuka, semoga aman",5,belum dibuka semoga aman,0,0,0,0,0,1,0,0,0,0,0,1,24,4
xiaomi,Official Xiaomi POCO M6 (8GB+256GB) | Kamera utama 108 MP kelas pro | Helio G91-Ultra yang tangguh | 33 W Turbo Charging,"barang selalu sesuai pesanan karena saya sudah 2x beli disini,terima kasih tokopedia dan officialstore",5,barang selalu sesuai pesanan karena saya sudah x beli disini terima kasih tokopedia dan officialstore,0,0,0,0,0,0,0,0,0,0,0,0,101,15
xiaomi,Xiaomi Dual Mode Wireless Mouse 2  | Precise 1200 DPI Sensor | 2.4GHz wireless & Dual-mode | Palm-fit design | Ultra-silent clicking [Official Store],Bagus nyamam,5,bagus nyamam,1,0,0,0,1,0,1,0,0,0,1,0,12,2
xiaomi,"Xiaomi Redmi Pad SE 8.7 (4/128GB) | Layar 8.7"" | 90Hz | Baterai 6650mAh | Octa-Core [Official Store]","respon cepat, barang sesuai pesanan, paket aman. terimakasih",5,responsif cepat barang sesuai pesanan paket aman terimakasih,0,0,1,1,1,1,0,0,1,1,1,1,60,8
xiaomi,"Official Xiaomi GTV A 32""",Joss mantap,5,joss bagus,1,0,0,0,1,0,1,0,0,0,1,0,10,2
xiaomi,"Xiaomi Redmi 14C (6GB/128GB) (8GB/256GB) | Layar 6.88"" | Refresh rate 120 Hz | 50 MP dual kamera AI | Baterai 5.160 mAh | NFC [Official Store]",barang sesuai masih segel,5,barang sesuai masih segel,0,0,0,0,0,0,0,0,0,0,0,0,25,4
xiaomi,"Xiaomi Redmi 14C (6GB/128GB) (8GB/256GB) | Layar 6.88"" | Refresh rate 120 Hz | 50 MP dual kamera AI | Baterai 5.160 mAh | NFC [Official Store]","Garansi Panjang, Fitur Bagus, Spesifikasi utk harga segini mantep pokonya, pengiriman cepat, keaslian pasti asli kalo di official shop. Terimakasih kak. 🙏",5,garansi panjang fitur bagus spesifikasi utk harga segini mantep pokonya pengiriman cepat keaslian pasti asli kalo di official shop terimakasih kak,1,0,1,0,1,0,1,0,1,0,1,0,146,21
xiaomi,Xiaomi Official Mi WiFi Range Extender AC1200 High Speed,"pengiriman lama, seller kurang responsif, barang sesuai pesanan",4,pengiriman lambat seller kurang responsif barang sesuai pesanan,0,0,1,1,1,0,0,0,-1,1,-1,0,63,8
xiaomi,Xiaomi Gaming Monitor G24i | LCD IPS Cepat | Refresh rate 180 Hz yang tinggi | GTG 1 mdtk | Kualitas 1080P | Monitor gaming | [Official Store],"monitor gaming komputer ukuran 24 inch, merk xiaomi, harga terjangkau, produk original asli, lengkap kabel HDMI, adaptor power, buku petunjuk, kartu garansi, sudah dicoba...",5,monitor gaming komputer ukuran inch merk xiaomi harga terjangkau produk original asli lengkap kabel hdmi adaptor power buku petunjuk kartu garansi sudah dicoba,1,1,0,0,0,0,1,1,0,0,0,0,159,23
xiaomi,"Xiaomi Redmi Pad 2 (4/128G) | 11"" 2.5 Layar Super-jernih | Helio G100-Ultra [Official Store]","barangnya masih tersegel
pengiriman tepat

semoga awet",5,barangnya masih tersegel pengiriman tepat semoga awet,0,0,1,0,0,0,0,0,1,0,0,0,53,7
xiaomi,"Xiaomi Redmi Pad 2 (4/128G) | 11"" 2.5 Layar Super-jernih | Helio G100-Ultra [Official Store]","paket selamat aman sentosa, barang segel pengiriman aman double dus",5,paket selamat aman sentosa barang segel pengiriman aman double dus,0,0,1,0,0,1,0,0,-1,0,0,1,66,10
xiaomi,Xiaomi Redmi Note 14 5G | 108MP AI OIS Camera | MediaTek 7025-Ultra | IP64 Dust/Water-Resist [Official Store],barang bagus dan ori berfungsi normal smeoga awet dan barokah amin,5,barang bagus dan ori berfungsi normal smeoga awet dan barokah amin,1,0,0,0,1,0,1,0,0,0,1,0,66,11
xiaomi,"POCO F7 (12/512GB) | Snapdragon 8s Gen 4 | 6.83"" 1.5K 120Hz AMOLED | 50MP camera OIS [Official Store]","pengiriman cepat dan udah di tes normal, terimakasih",5,pengiriman cepat dan sudah di tes normal terimakasih,0,0,1,0,1,0,0,0,1,0,1,0,52,8
xiaomi,"POCO C75 (6/128GB) (8/256GB) | Layar 6,88"" | 50MP AI | 18W Pengisian cepat | NFC | Garansi 15 bulan [Official Store]",sayang gak bisa gosend ke jaksel,5,sayang tidak bisa gosend ke jaksel,0,0,0,1,0,0,0,0,0,-1,0,0,34,6
xiaomi,Xiaomi Wireless Mouse Comfort Edition |  Desain Ergonomis | Klik Senyap | Koneksi Nirkabel Stabil | Tahan Lama & Anti Aus [Official Store],"bagus sekali ini, nyaman dipakai",5,bagus sekali ini nyaman dipakai,1,0,0,0,1,1,1,0,0,0,1,1,31,5
xiaomi,"Official Xiaomi POCO Pad (8GB+256GB) | Snapdragon 7s Gen 2 | Layar 2,5K 12,1"" 120 Hz | Kapasitas baterai besar 10.000 mAh","barang segel,rapih,👍👍👍👍👍,sesuai deskripsi,paket rahasia",5,barang segel rapih sesuai deskripsi paket rahasia,0,0,0,0,0,1,0,0,0,0,0,1,49,7
xiaomi,POCO X7 Pro 5G | Dimensity 8400-Ultra | 6000mAh 90W HyperCharge | CrystalRes 1.5K AMOLED [Official Store],"Sekian kali nya belanja disini amanah dan terpecaya,
Terima kasih Xiaomi",5,sekian kali nya belanja disini amanah dan terpecaya terima kasih xiaomi,0,0,0,0,0,1,0,0,0,0,0,1,71,11
xiaomi,"Xiaomi Redmi 14C (6GB/128GB) (8GB/256GB) | Layar 6.88"" | Refresh rate 120 Hz | 50 MP dual kamera AI | Baterai 5.160 mAh | NFC [Official Store]","mantap bagus dan murah 
kerennya",5,bagus bagus dan murah kerennya,1,1,0,0,1,0,1,1,0,0,1,0,30,5
xiaomi,Xiaomi Smart Camera C301 | CCTV Indoor | 2K Ultra-clear HD | 3MP | AI Pendeteksi Manusia | Rotasi 360° dan Vertikal 107° | Fitur Call 2 Arah [ Official Store ],"mantaaaaaaaaap... barang sesuai deskripsi dan barang nya berkwalitas, pengiriman super cepat dan fast respond... Terimakasih dan semoga sukses terus yaaa...",5,mantaaaaaaaaap barang sesuai deskripsi dan barang nya berkwalitas pengiriman super cepat dan cepat respond terimakasih dan semoga sukses terus yaaa,1,0,1,1,1,0,-1,0,1,1,1,0,147,20
xiaomi,"Xiaomi Redmi Pad 2 (4/128G) | 11"" 2.5 Layar Super-jernih | Helio G100-Ultra [Official Store]","Barang datang agak sedikit terlambat dari waktu perkiraannya. Box juga sedikit bengkok seperti bekas benturan, tapi plastik tetap utuh. Pas pad nya dicek, tidak ada masal...",5,barang datang agak sedikit terlambat dari waktu perkiraannya box juga sedikit bengkok seperti bekas benturan tapi plastik tetap utuh pas pad nya dicek tidak ada masal,0,0,1,1,1,0,0,0,-1,-1,-1,0,166,26
xiaomi,Xiaomi Power Bank 20000mAh (Integrated Cable) | Kabel daya terintegrasi | Kapasitas baterai ultra-besar 20000mAh | Pengisian daya cepat dua arah USB-C | Kompatibel dengan berbagai perangkat [Official Store],so far so good. yang ini lumayan cepet ngirimnya. kemarin pesen Poco F7 Lama sampainya. ini lumayan cepet. barsngnya bagus.,5,so far so good yang ini lumayan cepet ngirimnya kemarin pesen poco f lambat sampainya ini lumayan cepet barsngnya bagus,1,0,1,1,1,0,1,0,-1,-1,0,0,119,20
xiaomi,"POCO F7 (12/512GB) | Snapdragon 8s Gen 4 | 6.83"" 1.5K 120Hz AMOLED | 50MP camera OIS [Official Store]","barang sesuai pengiriman cepat, packing aman dan rapih",5,barang sesuai pengiriman cepat packing aman dan rapih,0,0,1,0,1,1,0,0,1,0,1,1,53,8
xiaomi,XIAOMI OFFICIAL Xiaomi Smart Camera C300 2K Ultra-clear 3MP AI Detect,"sudah pakai cctv ini, skrg beli lg. fitur2nya ok. service sangat cepat.",5,sudah pakai cctv ini skrg beli lg fiturnya bagus service sangat cepat,1,0,1,0,1,0,1,0,1,0,1,0,69,12
xiaomi,"POCO C71 4+4G/128G Performa Cadas | 6.88"" 120Hz | Ekspansi RAM 8G / storage 128G [Official Store]",barang sesuai dengan pesanan terimakasih,5,barang sesuai dengan pesanan terimakasih,0,0,0,0,0,0,0,0,0,0,0,0,40,5
xiaomi,"Xiaomi Redmi Pad 2 (4/128G) | 11"" 2.5 Layar Super-jernih | Helio G100-Ultra [Official Store]",cakep bgt asli ...smooth dan layar tajam,5,cakep banget asli smooth dan layar tajam,1,0,0,0,1,0,1,0,0,0,1,0,40,7
xiaomi,POCO X7 Pro 5G | Dimensity 8400-Ultra | 6000mAh 90W HyperCharge | CrystalRes 1.5K AMOLED [Official Store],"Barang sesuai dengan pesanan dan datang dengan selamat, tapi sayang bintang 1 untuk tim ekspedisi nya.",5,barang sesuai dengan pesanan dan datang dengan selamat tapi sayang bintang untuk tim ekspedisi nya,0,0,1,0,0,0,0,0,-1,0,0,0,98,15
xiaomi,Xiaomi Pad 7 (8/256GB) | Snapdragon 7+ Gen 3 | Layar 11.2 3.2K 144Hz Dolby Vision Atmos [Official Store],"produk diterima dengan kondisi baik, packing aman",5,produk diterima dengan kondisi baik packing aman,0,0,0,1,0,1,0,0,0,1,0,1,48,7
xiaomi,Official Xiaomi POCO M6 (8GB+256GB) | Kamera utama 108 MP kelas pro | Helio G91-Ultra yang tangguh | 33 W Turbo Charging,terimakasih hp nya bagus. segel masih aman,5,terimakasih hp nya bagus segel masih aman,1,0,0,0,1,1,1,0,0,0,1,1,41,7
xiaomi,"POCO C71 4+4G/128G Performa Cadas | 6.88"" 120Hz | Ekspansi RAM 8G / storage 128G [Official Store]",Terima kasih barang sesuai deskripsi Peking rapi aman pengiriman cepat...,5,terima kasih barang sesuai deskripsi peking rapi aman pengiriman cepat,0,0,1,0,1,1,0,0,1,0,1,1,70,10
xiaomi,"POCO C71 4+4G/128G Performa Cadas | 6.88"" 120Hz | Ekspansi RAM 8G / storage 128G [Official Store]",Terima kasih barang sesuai deskripsi Peking rapi aman pengiriman cepat...,5,terima kasih barang sesuai deskripsi peking rapi aman pengiriman cepat,0,0,1,0,1,1,0,0,1,0,1,1,70,10
xiaomi,Xiaomi Redmi Note 14 | 108 MP AI Camera | 5500mAh 33W Turbo Charging | MediaTek Helio G99 Ultra | [Official Store],"barang ori real sesuai pesanan, tdk ada kendala, bagus normal",5,barang ori real sesuai pesanan tdk ada kendala bagus normal,1,0,0,0,1,0,1,0,0,0,1,0,59,10
xiaomi,"POCO F7 (12/512GB) | Snapdragon 8s Gen 4 | 6.83"" 1.5K 120Hz AMOLED | 50MP camera OIS [Official Store]","pesanan tggl 9, waktu checkout estimasi tiba 11-12 juli. actualnya baru sampe tggl 16 Juli. tanya dichat balesnya lama banget ada yg 1 hati baru dibalesnya dan dijawab ma...",1,pesanan tggl waktu checkout estimasi tiba juli actualnya baru sampe tggl juli tanya dichat balesnya lambat banget ada yg hati baru dibalesnya dan dijawab ma,0,0,1,1,1,0,0,0,-1,-1,-1,0,156,25
xiaomi,Xiaomi 14T (12/512) | Leica Summilux Optical Lens | MediaTek Dimensity 8300-Ultra | 144Hz AI display [Official Store],HP sangat bagus,5,hp sangat bagus,1,0,0,0,1,0,1,0,0,0,1,0,15,3
xiaomi,"Xiaomi Smart Band 10 | 1.72"" AMOLED display | 150+ sports modes | Battery up to 21 days [Official Store]",Barang sudah sampai.. Seller recomendedd,5,barang sudah sampai seller recomendedd,0,0,0,0,0,0,0,0,0,0,0,0,38,5
xiaomi,Xiaomi Redmi 13X (8G/128G) (8G/256G) | 108 MP makin auto glow-up kamera | 5030mAh 33W | NFC [Official Store],barang original sesuai dengan di aplikasi,5,barang original sesuai dengan di aplikasi,1,0,0,0,0,0,1,0,0,0,0,0,41,6
xiaomi,"Official Xiaomi GTV A 32""","paket diterima dengan baik,",5,paket diterima dengan baik,0,0,0,1,0,0,0,0,0,1,0,0,26,4
xiaomi,"POCO F7 (12/512GB) | Snapdragon 8s Gen 4 | 6.83"" 1.5K 120Hz AMOLED | 50MP camera OIS [Official Store]",kualitas ok. dapat promo harga. dan promo garansi. pelayanan seller jg ok. Alhamdulillah,5,kualitas bagus dapat promo harga dan promo garansi pelayanan seller jg bagus alhamdulillah,1,0,0,0,1,0,1,0,0,0,1,0,90,13
xiaomi,Xiaomi Redmi Note 14 5G | 108MP AI OIS Camera | MediaTek 7025-Ultra | IP64 Dust/Water-Resist [Official Store],"bagus no lecet , sat set.. langsung sampai",5,bagus no lecet sat set langsung sampai,1,0,0,0,1,0,1,0,0,0,1,0,38,7
xiaomi,Xiaomi Redmi Buds 6 Play | Bluetooth 5.4 | Baterai Hingga 36 Jam | Xiaomi Earbuds App Support | Nyaman Digunakan [Official Store],"Barang kondisi baik.. berfungsi. Pengiriman cepat & aman. 
Terima kasih Seller",5,barang kondisi baik berfungsi pengiriman cepat aman terima kasih seller,0,0,1,1,1,1,0,0,1,1,1,1,71,10
xiaomi,"POCO F7 (12/512GB) | Snapdragon 8s Gen 4 | 6.83"" 1.5K 120Hz AMOLED | 50MP camera OIS [Official Store]","barangnya bagus, pasangan saya suka. terima kasih",5,barangnya bagus pasangan saya suka terima kasih,1,0,0,0,1,0,1,0,0,0,1,0,47,7
xiaomi,"Xiaomi Redmi Watch 5 Lite | 1.96"" AMOLED Display | Built-in GNSS | Baterai hingga 18 hari | 150+ mode olahraga [Official Store]","siip barang bagus, normal beroperasi lancar",5,siip barang bagus normal beroperasi lancar,1,0,0,0,1,0,1,0,0,0,1,0,42,6
xiaomi,Official Xiaomi POCO M6 (8GB+256GB) | Kamera utama 108 MP kelas pro | Helio G91-Ultra yang tangguh | 33 W Turbo Charging,"Produk sesuai, kualitasnya ok. Recommended Seller pokoknya. 👍🏻",5,produk sesuai kualitasnya bagus rekomendasi seller pokoknya,1,0,0,0,1,0,1,0,0,0,1,0,59,7
xiaomi,"POCO F7 (12/512GB) | Snapdragon 8s Gen 4 | 6.83"" 1.5K 120Hz AMOLED | 50MP camera OIS [Official Store]",good barang sesuai,5,good barang sesuai,0,0,0,0,0,0,0,0,0,0,0,0,18,3
xiaomi,"POCO C75 (6/128GB) (8/256GB) | Layar 6,88"" | 50MP AI | 18W Pengisian cepat | NFC | Garansi 15 bulan [Official Store]","sesuai deskripsi, lengkap, berfungsi baik",5,sesuai deskripsi lengkap berfungsi baik,0,0,0,1,0,0,0,0,0,1,0,0,39,5
xiaomi,"Xiaomi Redmi Watch 5 Active | 2.0"" LCD Display | Mendukung 140+ mode olahraga | Tahan air 5ATM | Baterai tahan hingga 18 hari | Jam tangan pintar [Official Store]","produknya bagus, warna sesuai dengan pesanan, setelah dicoba berfungsi dengan normal",5,produknya bagus warna sesuai dengan pesanan setelah dicoba berfungsi dengan normal,1,0,0,0,1,0,1,0,0,0,1,0,82,11
xiaomi,POCO X7 Pro 5G | Dimensity 8400-Ultra | 6000mAh 90W HyperCharge | CrystalRes 1.5K AMOLED [Official Store],"Barang bagus, ORIGINAL segel, pengiriman aman dan tepat waktu.",5,barang bagus original segel pengiriman aman dan tepat waktu,1,0,1,0,1,1,1,0,1,0,1,1,59,9
xiaomi,"POCO F7 (12/512GB) | Snapdragon 8s Gen 4 | 6.83"" 1.5K 120Hz AMOLED | 50MP camera OIS [Official Store]","barang di packing dengan sangat aman, hp berfungsi dengan baik, semoga awet 👍",5,barang di packing dengan sangat aman hp berfungsi dengan baik semoga awet,0,0,0,1,0,1,0,0,0,1,0,1,73,12
xiaomi,Official Xiaomi POCO M6 (8GB+256GB) | Kamera utama 108 MP kelas pro | Helio G91-Ultra yang tangguh | 33 W Turbo Charging,barang sesuai gambar ORI masih di segel terimakasih seller is the best,5,barang sesuai gambar ori masih di segel terimakasih seller is the best,0,0,0,0,0,0,0,0,0,0,0,0,70,12
xiaomi,"POCO F7 (12/512GB) | Snapdragon 8s Gen 4 | 6.83"" 1.5K 120Hz AMOLED | 50MP camera OIS [Official Store]",Kurir nya latteung,1,kurir nya latteung,0,0,0,0,0,0,0,0,0,0,0,0,18,3
xiaomi,"Xiaomi Redmi Pad 2 (4/128G) | 11"" 2.5 Layar Super-jernih | Helio G100-Ultra [Official Store]",Lama banget pengirimannya. Astagaaaa....,2,lambat banget pengirimannya astagaaaa,0,0,1,1,1,0,0,0,-1,-1,-1,0,37,4
xiaomi,"POCO F7 (12/512GB) | Snapdragon 8s Gen 4 | 6.83"" 1.5K 120Hz AMOLED | 50MP camera OIS [Official Store]",barang original garansi Xiaomi. Sampai sesuai dgn waktu yang dikirimkan dengan kondisi aman. utk kelengkapan barang sesuai dengan list yg diinformasikan dalam iklan. Teri...,5,barang original garansi xiaomi sampai sesuai dgn waktu yang dikirimkan dengan kondisi aman utk kelengkapan barang sesuai dengan list yg diinformasikan dalam iklan teri,1,0,0,0,0,1,1,0,0,0,0,1,167,24
xiaomi,Official Xiaomi Mi Braided USB Type-C Cable 100cm,"Sesuai deskripsi dan original
Niceee",5,sesuai deskripsi dan original niceee,1,0,0,0,0,0,1,0,0,0,0,0,36,5
xiaomi,Xiaomi Redmi Buds 6 Active | Google Fast Pair | Baterai Hingga 30 Jam | Audio Spasial | IPX 4 [Official Store],"bintang 5 buat produknya, buat pengiriman nya minus 3... masa 3x gagal pick up, aneh bgt",4,bintang buat produknya buat pengiriman nya minus masa x gagal pick up aneh banget,0,0,0,0,0,0,0,0,0,0,0,0,81,14
xiaomi,Xiaomi Redmi Note 14 Pro 5G | 200MP AI OIS Camera | MediaTek Dimensity 7300-Ultra | Gorilla Victus 2 [Official Store],"keren banget hapenyaaaa, setelah 5 tahun akhirnya ganti jugaaaa. terimakasih 🤩 ppwngiriman aman banget",5,keren banget hapenyaaaa setelah tahun akhirnya ganti jugaaaa terimakasih ppwngiriman aman banget,0,0,0,0,0,1,0,0,0,0,0,1,96,12
xiaomi,"POCO F7 (12/512GB) | Snapdragon 8s Gen 4 | 6.83"" 1.5K 120Hz AMOLED | 50MP camera OIS [Official Store]",Performa mantap,5,performa bagus,1,0,0,0,1,0,1,0,0,0,1,0,14,2
xiaomi,POCO X7 Pro 5G | Dimensity 8400-Ultra | 6000mAh 90W HyperCharge | CrystalRes 1.5K AMOLED [Official Store],"lengkap, tersegel dengan rapih, dan aman",5,lengkap tersegel dengan rapih dan aman,0,0,0,0,0,1,0,0,0,0,0,1,38,6
xiaomi,Xiaomi Wireless Mouse Comfort Edition |  Desain Ergonomis | Klik Senyap | Koneksi Nirkabel Stabil | Tahan Lama & Anti Aus [Official Store],"design material good, penggunaan silent, kualitas xiaomi ok lah, harga kompetitif, semoga awet.",5,design material good penggunaan silent kualitas xiaomi bagus lah harga kompetitif semoga awet,1,0,0,0,1,0,1,0,0,0,1,0,93,13
xiaomi,Xiaomi Redmi 13X (8G/128G) (8G/256G) | 108 MP makin auto glow-up kamera | 5030mAh 33W | NFC [Official Store],barang bagus... masih segel... ok. kirimannya... tepat waktu,5,barang bagus masih segel bagus kirimannya tepat waktu,1,0,1,0,1,0,1,0,1,0,1,0,53,8
xiaomi,"POCO F7 (12/512GB) | Snapdragon 8s Gen 4 | 6.83"" 1.5K 120Hz AMOLED | 50MP camera OIS [Official Store]","barang masih di segel pada saat sampai, pengirimanan cepat sampai, waktu di buka ada garansi resminya, barang berfungsi dengan  baik, kualitas barang original anak saya s...",5,barang masih di segel pada saat sampai pengirimanan cepat sampai waktu di buka ada garansi resminya barang berfungsi dengan baik kualitas barang original anak saya s,1,0,1,1,1,0,1,0,1,1,1,0,165,26
xiaomi,"POCO F7 (12/512GB) | Snapdragon 8s Gen 4 | 6.83"" 1.5K 120Hz AMOLED | 50MP camera OIS [Official Store]","Barang tiba sempurna, masih segel, original. sudah di tes dan berfungsi normal",5,barang tiba sempurna masih segel original sudah di tes dan berfungsi normal,1,0,0,0,0,0,1,0,0,0,0,0,75,12
xiaomi,"POCO C75 (6/128GB) (8/256GB) | Layar 6,88"" | 50MP AI | 18W Pengisian cepat | NFC | Garansi 15 bulan [Official Store]","pengiriman lambat ,lebih tepat waktu 2 hari pengiriman ya harus tiba sore hari ditempat 2 hari pengiriman,barang aman dan aktif, berfungsi normal dengan baik",3,pengiriman lambat lebih tepat waktu hari pengiriman ya harus tiba sore hari ditempat hari pengiriman barang aman dan aktif berfungsi normal dengan baik,0,0,1,1,1,1,0,0,0,0,-1,1,151,23
xiaomi,Official Xiaomi POCO F6 (8GB+256GB) | (12GB + 512GB) Snapdragon 8s Gen 3 | LiquidCool Technology 4.0 IceLoop,"belum dibuka
mau langsung dikasih buat kakak yg datang ke rumah 9 Agustus 2025",5,belum dibuka mau langsung dikasih buat kakak yg datang ke rumah agustus,0,0,0,0,0,0,0,0,0,0,0,0,71,12
xiaomi,Xiaomi Pad 7 (8/256GB) | Snapdragon 7+ Gen 3 | Layar 11.2 3.2K 144Hz Dolby Vision Atmos [Official Store],"Barang bagus dapat bonus, semua normal semoga awet",5,barang bagus dapat bonus semua normal semoga awet,1,0,0,0,1,0,1,0,0,0,1,0,49,8
